{
  "band": "child",
  "dials": {
    "profanity": "off",
    "sexual": "off",
    "violence": "off",
    "substances": "off",
    "crime": "off",
    "hate": "off",
    "self_harm": "off",
    "privacy": "off"
  },
  "floor": ["harmful_request", "credible_threat", "csam", "grooming", "pii_extraction", "prompt_injection", "jailbreak"],
  "hlc": "1757073600000:0:a1b2c3"
}
